{
  "$schema": "http://json-schema.org/draft-07/schema#",
  "type": "object",
  "properties": {
    "id": {
      "type": "string",
      "description": "Unique identifier for the conversation.",
      "example": "e0c0b3cc-8238-414f-9940-9f14bd1b8693"
    },
    "userKey": {
      "type": "string",
      "description": "Unique user identifier in the Customer's system.",
      "example": "d5dbb8e0-192e-4bc6-972c-f7948409d10c"
    },
    "url": {
      "type": "string",
      "description": "Unique web address to which the user should be redirected to verify their identity.",
      "example": "https://authologic.com/tests/return/?conversation={conversationId}"
    },
    "status": {
      "$ref": "common/conversation_status.json"
    },
    "result": {
      "$ref": "common/conversation_result.json"
    },
    "externalLinks": {
      "type": "object",
      "additionalProperties": {
        "type": "string",
        "description": "Links to 3rd party API that allow to collect data directly from 3rd party API. Available in specific strategies."
      },
      "description": "Links to 3rd party API that allow to collect data directly from 3rd party API. Available in specific strategies."
    }
  }
}
