{
  "id": "c12c1adc-3ff0-4d32-b95c-c593135c903e",
  "userKey": "7dfb9ded-c38f-49ae-95e2-307283a0b1f6",
  "url": "https://sandbox.authologic.com/c/c12c1adc-3ff0-4d32-b95c-c593135c903e",
  "status": "IN_PROGRESS",
  "result": {
    "identity": {
      "status": "IN_PROGRESS",
      "user": {}
    }
  }
}
