{
  "id": "e0c0b3cc-8238-414f-9940-9f14bd1b8693",
  "userKey": "d5dbb8e0-192e-4bc6-972c-f7948409d10c",
  "url": "https://sandbox.authologic.com/c/c12c1adc-3ff0-4d32-b95c-c593135c903e",
  "status": "FINISHED",
  "result": {
    "identity": {
      "status": "FINISHED",
      "user": {
        "person": {
          "name": {
            "firstName": "John",
            "lastName": "Doe"
          }
        }
      }
    },
    "verify": {
      "status": "FINISHED",
      "reliability": 0.6666666666666667,
      "details": [
        {
          "field": "PERSON_NAME_FIRSTNAME",
          "reliability": 0.6666666666666667
        },
        {
          "field": "PERSON_NAME_LASTNAME",
          "reliability": 1
        }
      ]
    },
    "bankTransactions": {
      "status": "FINISHED"
    }
  }
}
